{
 "schema": "ubl-activity-diagram-extraction/1",
 "figure": "UBL-2.3-CommonTransportationReportProcess",
 "nodes": {
  "initial-reporter-party": {
   "area": 6632,
   "fill": 0.767
  },
  "object-common-transportation-report": {
   "area": 155345,
   "fill": 0.931,
   "solid": 1.0,
   "stem": 0.085
  },
  "action-send-report": {
   "area": 90585,
   "fill": 0.947,
   "solid": 0.994,
   "stem": 0.085
  },
  "action-receive-report": {
   "area": 88863,
   "fill": 0.929,
   "solid": 0.994,
   "stem": 0.085
  },
  "final-authority-party": {
   "area": 7073,
   "fill": 0.374,
   "solid": 0.786
  }
 },
 "flows": {
  "flow-initial-reporter-party-to-send-report": {
   "arrowInk": [
    225,
    770
   ],
   "arrowPx": [
    40,
    42.0,
    2.18
   ],
   "arrowFill": 0.644
  },
  "flow-send-report-to-common-transportation-report": {
   "arrowInk": [
    225,
    782
   ],
   "arrowPx": [
    38,
    42.0,
    2.48
   ],
   "arrowFill": 0.642
  },
  "flow-common-transportation-report-to-receive-report": {
   "arrowInk": [
    225,
    779
   ],
   "arrowPx": [
    40,
    42.0,
    2.18
   ],
   "arrowFill": 0.659
  },
  "flow-receive-report-to-final-authority-party": {
   "arrowInk": [
    225,
    766
   ],
   "arrowPx": [
    40,
    42.0,
    2.15
   ],
   "arrowFill": 0.674
  }
 },
 "offPage": {},
 "marks": {},
 "phases": {},
 "greyRules": [],
 "titleReadings": [
  {
   "position": 0,
   "text": "Reporter Party",
   "x": 844,
   "y": 82,
   "w": 365,
   "h": 52,
   "lines": [
    {
     "x": 844,
     "y": 82,
     "w": 365,
     "h": 52,
     "text": "Reporter Party"
    }
   ]
  },
  {
   "position": 1,
   "text": "Authority Party",
   "x": 2499,
   "y": 82,
   "w": 372,
   "h": 52,
   "lines": [
    {
     "x": 2499,
     "y": 82,
     "w": 372,
     "h": 52,
     "text": "Authority Party"
    }
   ]
  }
 ],
 "findings": [],
 "uncertain": [],
 "present": [
  "source",
  "size",
  "fontPx",
  "arrowPx",
  "arrowWidthPx",
  "arrowStyle",
  "rules",
  "ruleSpan",
  "greyRules",
  "dashed",
  "openEnds",
  "crossMarks",
  "partitions",
  "nodes",
  "edges",
  "text",
  "uncertain"
 ],
 "uncorrected": {
  "model": {
   "schema": "ubl-activity-diagram/1",
   "figure": {
    "name": "UBL-2.3-CommonTransportationReportProcess",
    "source": "UBL-2.3-CommonTransportationReportProcess.png"
   },
   "lanes": [
    {
     "id": "lane0",
     "axis": "column",
     "index": 0,
     "title": "Reporter Party"
    },
    {
     "id": "lane1",
     "axis": "column",
     "index": 1,
     "title": "Authority Party"
    },
    {
     "id": "lane2",
     "axis": "band",
     "index": 0,
     "title": ""
    }
   ],
   "nodes": [
    {
     "id": "n1",
     "kind": "initial",
     "label": "",
     "lane": "lane0",
     "band": "lane2"
    },
    {
     "id": "n2",
     "kind": "object",
     "label": "Common\nTransportation Report",
     "lane": "lane1",
     "band": "lane2"
    },
    {
     "id": "n3",
     "kind": "action",
     "label": "Send report",
     "lane": "lane0",
     "band": "lane2"
    },
    {
     "id": "n4",
     "kind": "action",
     "label": "Receive Report",
     "lane": "lane1",
     "band": "lane2"
    },
    {
     "id": "n5",
     "kind": "final",
     "label": "",
     "lane": "lane1",
     "band": "lane2"
    }
   ],
   "flows": [
    {
     "id": "f0",
     "from": "n1",
     "to": "n3",
     "kind": "control",
     "direction": {
      "confidence": "high"
     }
    },
    {
     "id": "f1",
     "from": "n3",
     "to": "n2",
     "kind": "object",
     "direction": {
      "confidence": "high"
     }
    },
    {
     "id": "f2",
     "from": "n2",
     "to": "n4",
     "kind": "object",
     "direction": {
      "confidence": "high"
     }
    },
    {
     "id": "f3",
     "from": "n4",
     "to": "n5",
     "kind": "control",
     "direction": {
      "confidence": "high"
     }
    }
   ],
   "texts": [],
   "offPage": [],
   "marks": [],
   "phases": []
  },
  "layout": {
   "schema": "ubl-activity-diagram-layout/1",
   "figure": "UBL-2.3-CommonTransportationReportProcess",
   "units": "px of the original PNG",
   "size": [
    3426,
    1291
   ],
   "style": {
    "fontPx": 58.6,
    "arrowPx": 40.0,
    "arrowWidthPx": 42.0,
    "arrowStyle": "filled"
   },
   "rules": {
    "vertical": [
     {
      "at": 2,
      "width": 10,
      "span": [
       15,
       1279
      ]
     },
     {
      "at": 1710,
      "width": 10,
      "span": [
       15,
       1279
      ]
     },
     {
      "at": 3418,
      "width": 7,
      "span": [
       15,
       1279
      ]
     }
    ],
    "horizontal": [
     {
      "at": 2,
      "width": 10,
      "span": [
       15,
       3414
      ]
     },
     {
      "at": 1283,
      "width": 7,
      "span": [
       15,
       3414
      ]
     }
    ]
   },
   "greyRules": [],
   "lanes": {
    "lane0": {
     "x0": 0,
     "x1": 1715,
     "titleBox": [
      844,
      82,
      365,
      52
     ]
    },
    "lane1": {
     "x0": 1715,
     "x1": 3426,
     "titleBox": [
      2499,
      82,
      372,
      52
     ]
    },
    "lane2": {
     "y0": 0,
     "y1": 1291
    }
   },
   "nodes": {
    "n1": {
     "x": 788,
     "y": 242,
     "w": 99,
     "h": 99
    },
    "n2": {
     "x": 1435,
     "y": 439,
     "w": 607,
     "h": 275,
     "shape": "rect",
     "stroke": 10,
     "rx": 0,
     "ry": 0,
     "bold": false,
     "labelLines": [
      {
       "x": 1624,
       "y": 523,
       "w": 224,
       "h": 43,
       "text": "Common"
      },
      {
       "x": 1462,
       "y": 590,
       "w": 549,
       "h": 52,
       "text": "Transportation Report"
      }
     ]
    },
    "n3": {
     "x": 579,
     "y": 484,
     "w": 517,
     "h": 185,
     "shape": "rounded",
     "stroke": 5,
     "rx": 24,
     "ry": 24,
     "bold": false,
     "labelLines": [
      {
       "x": 689,
       "y": 556,
       "w": 294,
       "h": 53,
       "text": "Send report"
      }
     ]
    },
    "n4": {
     "x": 2429,
     "y": 484,
     "w": 517,
     "h": 185,
     "shape": "rounded",
     "stroke": 5,
     "rx": 24,
     "ry": 24,
     "bold": false,
     "labelLines": [
      {
       "x": 2494,
       "y": 557,
       "w": 386,
       "h": 52,
       "text": "Receive Report"
      }
     ]
    },
    "n5": {
     "x": 2619,
     "y": 991,
     "w": 137,
     "h": 138,
     "shape": "ellipse",
     "stroke": 5,
     "rx": 74,
     "ry": 66,
     "innerRatio": 0.715
    }
   },
   "flows": {
    "f0": {
     "fromPoint": [
      837,
      355
     ],
     "toPoint": [
      837,
      469
     ],
     "routing": "straight"
    },
    "f1": {
     "fromPoint": [
      1110,
      576
     ],
     "toPoint": [
      1420,
      576
     ],
     "routing": "straight"
    },
    "f2": {
     "fromPoint": [
      2056,
      576
     ],
     "toPoint": [
      2414,
      576
     ],
     "routing": "straight"
    },
    "f3": {
     "fromPoint": [
      2687,
      683
     ],
     "toPoint": [
      2687,
      976
     ],
     "routing": "straight"
    }
   },
   "texts": {},
   "offPage": {},
   "marks": {},
   "phases": {},
   "rulesHaveSpans": {
    "vertical": true,
    "horizontal": true
   }
  }
 },
 "documentLanes": {
  "object-common-transportation-report": "lane-authority-party"
 },
 "formerIds": {
  "lane-reporter-party": "lane0",
  "lane-authority-party": "lane1",
  "initial-reporter-party": "n1",
  "object-common-transportation-report": "n2",
  "action-send-report": "n3",
  "action-receive-report": "n4",
  "final-authority-party": "n5",
  "flow-initial-reporter-party-to-send-report": "f0",
  "flow-send-report-to-common-transportation-report": "f1",
  "flow-common-transportation-report-to-receive-report": "f2",
  "flow-receive-report-to-final-authority-party": "f3"
 }
}
